{
  "id": "com.enest.clipboard",
  "name": "粘贴板",
  "version": "1.0.1",
  "description": "剪贴板历史、图片回显与快速选中回写",
  "author": "eNest Labs",
  "main": "index.html",
  "category": "效率",
  "icon": "icon.svg",
  "engines": {
    "enest": ">=0.1.0"
  },
  "permissions": [
    "clipboard.read",
    "clipboard.write",
    "clipboard.readImage",
    "clipboard.writeImage",
    "clipboard.history",
    "ui.setTitle",
    "ui.toast"
  ],
  "window": {
    "minWidth": 420,
    "minHeight": 360
  },
  "features": [
    {
      "code": "main",
      "explain": "剪贴板历史",
      "cmds": [
        "剪贴板",
        "clipboard",
        "粘贴板"
      ]
    }
  ],
  "ui": {
    "chrome": "none",
    "themeAware": true,
    "background": "opaque",
    "preferredColorScheme": "auto"
  },
  "market": {
    "featured": true,
    "tags": [
      "剪贴板",
      "历史",
      "效率"
    ]
  }
}
