{
  "id": "com.enest.password-kit",
  "name": "密码工具箱",
  "version": "1.0.0",
  "description": "随机密码生成（长度/字符集可调、强度提示）与 UUID v4 批量生成。",
  "author": "eNest Labs",
  "main": "index.html",
  "category": "效率",
  "icon": "icon.svg",
  "permissions": [
    "clipboard.write",
    "ui.setTitle",
    "ui.toast"
  ],
  "engines": {
    "enest": ">=0.1.0"
  },
  "features": [
    {
      "code": "main",
      "cmds": [
        "密码",
        "password",
        "uuid"
      ]
    }
  ],
  "market": {
    "tags": [
      "密码",
      "uuid",
      "安全"
    ]
  }
}
